gen	start_sha	solver_sha	intent_err	status	hypothesis
0	d1f8d373b583	d1f8d373b583	0.25771421	keep	baseline
1	d1f8d373b583	d808d4fb017c	0.39247585	discard	Bind semantic outer-dimension parameters to the generated box extents so held-out length, width, and height variants regenerate at the requested size.
2	d1f8d373b583	2c25f0a92afc	0.23539890	keep	Bind an exact height parameter to the generated box Z extent while leaving the observed X and Y extents unchanged.
3	2c25f0a92afc	633286b5904f	0.19674081	keep	Bind an exact width parameter to the generated box X extent while preserving the accepted height binding and observed Y extent.
4	633286b5904f	e151ec6efbce	0.19674081	discard	Bind an exact length parameter to the generated box Y extent while preserving the accepted width and height bindings.
5	633286b5904f	3bd95e4b96f9	0.15682262	keep	Bind an exact depth parameter to the generated box Y extent while preserving the accepted width and height bindings.
6	3bd95e4b96f9	7607340a064f	0.14009414	keep	Recognize exact cylindrical bodies with a radius parameter and regenerate their circular profile from that parameter.
7	7607340a064f	52cd96e6ade0	0.14009414	discard	Recognize a centered Z-axis through-hole in a rectangular body and regenerate its cut from the hole_radius parameter.
8	7607340a064f	9d8cee3e69b5	0.14009414	discard	Bind an exact thickness parameter to the generated extrusion Z extent while preserving the accepted width, depth, height, and cylinder behavior.
9	7607340a064f	9d0186596bee	0.14009414	discard	Recognize exact cylindrical bodies with a diameter parameter and regenerate their circular profile at half that diameter.
10	7607340a064f	c4d492e8397f	0.14009414	discard	Recognize a single offset Z-through-hole in a rectangular body and drive its radius and center from hole_radius plus hole_x or hole_y parameters.
11	7607340a064f	cc476f0dea57	0.14009414	discard	Bind a length parameter to the axial Z dimension of an exact outer cylinder when no height parameter is present.
12	7607340a064f	548ba6d09d60	0.14009414	discard	Bind a length parameter to the generated X extent when width is absent, testing the alternative axis to the previously discarded Y mapping.
13	7607340a064f	a6907fe134cd	0.14009414	discard	Recognize a centered Z-axis cylindrical through-hole from its volume deficit and cylindrical topology, then regenerate the cut from the radius parameter.
14	7607340a064f	9b3a0880dc22	0.14009414	discard	Recognize rectangular prisms with four vertically filleted corners and regenerate those corner blends from the fillet_radius parameter.
15	7607340a064f	d7b57b741ef5	0.11473228	keep	Bind the exact thick parameter to the generated plate Z extent while preserving the accepted width, depth, height, and cylinder behavior.
16	d7b57b741ef5	4783be8a68ed	0.11473228	discard	Recognize a rectangular base with one cylindrical boss and regenerate its radius, height, and optional center offsets from boss parameters.
17	d7b57b741ef5	b16ab7ab202d	0.11473228	discard	Recognize annular cylinders and regenerate their outer and inner cylindrical profiles from outer_radius and inner_radius.
18	d7b57b741ef5	4419c8e04332	0.11372844	keep	Recognize the exact width/depth/thick/hole_d family as a centered through-hole plate and regenerate the cut from the diameter parameter.
19	4419c8e04332	2b1413bab16f	0.11287179	keep	Recognize the exact offset through-hole plate family and drive the cut diameter and center from hole_d, hole_x, and hole_y.
20	2b1413bab16f	4cdcd15d6929	0.11287179	discard	Recognize the exact centered through-slot plate family and regenerate its cut from slot_length and slot_width.
21	2b1413bab16f	de89dd505531	0.08468746	keep	Recognize the exact outer_r/inner_r/height annular-cylinder family and regenerate both radii and height from its parameters.
22	de89dd505531	81ae3cd66b41	0.08468746	discard	Recognize the exact centered counterbored through-hole plate family and regenerate its through diameter, recess diameter, and recess depth from counterbore parameters.
23	de89dd505531	7c95a336659e	0.08468746	discard	Recognize the exact width/depth/thick/fillet_r plate family and regenerate its four vertical corner fillets from the radius parameter.
24	de89dd505531	b550545537e3	0.08468746	discard	Recognize the exact offset cylindrical-boss plate family and regenerate its radius, height, and center from boss_r, boss_h, boss_x, and boss_y.
25	de89dd505531	1f38df6b098a	0.08468746	discard	Recognize the exact width/depth/thick/chamfer_d plate family and regenerate its four vertical corner chamfers from the distance parameter.
26	de89dd505531	87b6c00675d8	0.08468746	discard	Recognize the exact rectangular four-hole pattern family and regenerate its 2x2 through-hole layout from hole_d, pitch_x, and pitch_y.
27	de89dd505531	239f00dc28e8	0.08468746	discard	Recognize the exact centered cylindrical-boss plate family and regenerate its boss radius and height from boss_r and boss_h.
28	de89dd505531	0f4a6efe955e	0.08468746	discard	Recognize an exact spherical body with a lone radius parameter and regenerate its radius for held-out family members.
29	de89dd505531	12b157fa1337	0.08468746	discard	Recognize the exact centered blind-hole plate family and regenerate its cut diameter and depth from hole_d and hole_depth.
30	de89dd505531	686206b37c9d	0.08468746	discard	Recognize centered through-slot plates by semantic slot parameters and regenerate the slot while supporting either thick or height as the plate Z dimension.
31	de89dd505531	3201a5be9df1	0.01282032	keep	Recognize the public plate_t/boss_d cylindrical-boss families and regenerate the centered or offset boss from its diameter, height, and optional center parameters.
32	3201a5be9df1	9c770187cef3	0.01066575	keep	Recognize centered through-slot plates whose dimensions use slot_l/slot_len/slot_length and slot_w/slot_width aliases, and regenerate the cut from those parameters.
33	9c770187cef3	fa999660176d	0.01056640	keep	Recognize the width/depth/height/fillet_r prism family and regenerate its four vertical corner fillets from fillet_r.
34	fa999660176d	dc31b513fb34	0.01056640	discard	Recognize the width/depth/height/chamfer_d prism family and regenerate its four vertical edge chamfers from chamfer_d.
35	fa999660176d	31545dfcafcd	0.01056640	discard	Recognize the exact bottom_r/top_r/height conical-frustum family and regenerate both end radii and axial height from its parameters.
36	fa999660176d	c9be7439ef4a	0.01056640	discard	Recognize the exact centered countersunk through-hole plate family and regenerate its bore and conical recess from hole_d, csk_d, and csk_angle.
37	fa999660176d	10fb41d28da8	0.01056640	discard	Recognize centered counterbored through-hole plates using common cbore/counterbore diameter and depth parameter aliases and regenerate the stepped cut.
38	fa999660176d	aa17994e4835	0.01056640	discard	Infer each plain box axis as centered or origin-anchored from the observed bounding box so parameterized variants preserve the intended coordinate convention.
39	fa999660176d	c28ffcaf9c16	0.01056640	discard	Recognize centered rectangular blind-pocket plates from pocket dimension aliases and regenerate the recess from its length, width, and depth parameters.
40	fa999660176d	8706f0a8ccd2	0.01056640	discard	Bind an exact thickness parameter to the generated Z extent, extending the accepted thick behavior to this common dimensional alias.
